{
  "schema": "blocks-engine/php-transformer/parity-fixture/v1",
  "name": "html-custom-block-low-confidence-unchanged",
  "description": "A custom-element subtree with weak structural signals does NOT clear the conservative custom_block gate, so no block type is generated (issue #497). A custom element holding only text keeps that text as an editable core/paragraph instead of an unsupported_element fallback: its runtime formatting is not portable, its text is.",
  "source_reference": {
    "repo": "php-transformer",
    "path": "tests/fixtures/parity/html-custom-block-low-confidence-unchanged.json",
    "notes": "Negative control for generation: a single inline child carries no custom_block signal. Its text converts to a paragraph."
  },
  "legacy_comparison": {
    "skip": true,
    "reason": "Negative control for new producer-link behavior; no downstream legacy comparison."
  },
  "operation": "html_transformer.transform",
  "input": {
    "content": "<my-widget><span>hello there</span></my-widget>"
  },
  "expect": [
    {"path": "status", "assert": "equals", "value": "success"},
    {"path": "source_reports.generated_blocks", "assert": "count", "count": 0},
    {"path": "fallbacks", "assert": "count", "count": 0},
    {"path": "blocks", "assert": "count", "count": 1},
    {"path": "blocks.0.blockName", "assert": "equals", "value": "core/paragraph"}
  ]
}
