{
  "schema": "blocks-engine/php-transformer/parity-fixture/v1",
  "name": "artifact-runtime-script-not-materialized",
  "description": "Flags a source-declared external client script that was never materialized or carried into the artifact, so dependent interactions are non-functional.",
  "source_reference": {
    "repo": "php-transformer",
    "path": "tests/fixtures/parity/artifact-runtime-script-not-materialized.json",
    "notes": "Generic runtime-dependency parity: a referenced <script src> requiring client_script_execution with no backing artifact file must surface a feature-parity finding."
  },
  "legacy_comparison": {
    "skip": true,
    "reason": "Runtime dependency parity is an upstream artifact compiler contract with no legacy comparison."
  },
  "operation": "artifact_compiler.compile",
  "input": {
    "artifact": {
      "entrypoint": "index.html",
      "files": [
        {
          "path": "index.html",
          "kind": "html",
          "content": "<main><div class=\"counter\"><button id=\"increment\">Add</button><span id=\"total\">0</span></div><script src=\"js/app.js\"></script></main>"
        }
      ]
    }
  },
  "expect": [
    { "path": "status", "assert": "equals", "value": "success_with_warnings" },
    { "path": "source_reports.runtime_dependency_parity.status", "assert": "equals", "value": "warning" },
    { "path": "source_reports.runtime_dependency_parity.findings", "assert": "count", "count": 1 },
    { "path": "source_reports.runtime_dependency_parity.findings.0.code", "assert": "equals", "value": "runtime_script_not_materialized" },
    { "path": "source_reports.runtime_dependency_parity.findings.0.severity", "assert": "equals", "value": "warning" },
    { "path": "source_reports.runtime_dependency_parity.findings.0.repair_bucket", "assert": "equals", "value": "runtime_script_materialization" },
    { "path": "source_reports.runtime_dependency_parity.findings.0.runtime_requirement", "assert": "equals", "value": "client_script_execution" },
    { "path": "source_reports.runtime_dependency_parity.findings.0.script_src", "assert": "equals", "value": "js/app.js" },
    { "path": "source_reports.conversion_report.runtime_dependency_parity.findings.0.code", "assert": "equals", "value": "runtime_script_not_materialized" }
  ]
}
