{
  "schema": "blocks-engine/php-transformer/parity-fixture/v1",
  "name": "artifact-custom-block-companion-payload",
  "description": "End-to-end producer link: a high-confidence custom_block compiles to a companion payload carrying sanitized static render HTML in the exact shape SSI validates and scaffolds (issues #497 / #491 / #853).",
  "source_reference": {
    "repo": "php-transformer",
    "path": "tests/fixtures/parity/artifact-custom-block-companion-payload.json",
    "notes": "Product-neutral custom element; the payload entry is generic and derived from structure only."
  },
  "legacy_comparison": {
    "skip": true,
    "reason": "New producer-link behavior with no downstream legacy comparison."
  },
  "operation": "artifact_compiler.compile",
  "input": {
    "artifact": {
      "schema": "blocks-engine/php-transformer/site-artifact/v1",
      "site_slug": "acme-co",
      "entrypoint": "index.html",
      "files": [
        {
          "path": "index.html",
          "kind": "html",
          "content": "<html><body><main><my-pricing><div class=\"tier\"><h3>Basic</h3><p>$9</p></div><div class=\"tier\"><h3>Pro</h3><p>$19</p></div><div class=\"tier\"><h3>Max</h3><p>$49</p></div></my-pricing></main></body></html>"
        }
      ]
    }
  },
  "expect": [
    { "path": "status", "assert": "equals", "value": "success" },
    { "path": "source_reports.companion_plugin_payload.schema", "assert": "equals", "value": "static-site-importer/companion-plugin/v1" },
    { "path": "source_reports.companion_plugin_payload.site_slug", "assert": "equals", "value": "acme-co" },
    { "path": "source_reports.companion_plugin_payload.blocks", "assert": "count", "count": 1 },
    { "path": "source_reports.companion_plugin_payload.blocks.0.name", "assert": "equals", "value": "collection-42ba83f51ffea3a7df69ca6f8c29d50848fd6a809917172303a2c79f3802c9bd" },
    { "path": "source_reports.companion_plugin_payload.blocks.0.block_json.name", "assert": "equals", "value": "ssi-acme-co/collection-42ba83f51ffea3a7df69ca6f8c29d50848fd6a809917172303a2c79f3802c9bd" },
    { "path": "source_reports.companion_plugin_payload.blocks.0.block_json.render", "assert": "equals", "value": "file:./render.php" },
    { "path": "source_reports.companion_plugin_payload.blocks.0.render", "assert": "equals", "value": "<div class=\"tier\"><h3>Basic</h3><p>$9</p></div><div class=\"tier\"><h3>Pro</h3><p>$19</p></div><div class=\"tier\"><h3>Max</h3><p>$49</p></div>" },
    { "path": "serialized_blocks", "assert": "contains", "value": "wp:ssi-acme-co/collection-42ba83f51ffea3a7df69ca6f8c29d50848fd6a809917172303a2c79f3802c9bd" }
  ]
}
