{
  "schema": "blocks-engine/php-transformer/parity-fixture/v1",
  "name": "artifact-runtime-nav-toggle-superseded-disposition",
  "description": "Records superseded hamburger menu-toggle dependencies without emitting missing-DOM-target findings when the transformer intentionally drops them in favor of core/navigation's responsive overlay, while selectors absent from the entry source remain dependency rows without becoming materialization failures.",
  "source_reference": {
    "repo": "php-transformer",
    "path": "tests/fixtures/parity/artifact-runtime-nav-toggle-superseded-disposition.json",
    "notes": "The .nav-toggle hamburger is folded into core/navigation, so a preserved script referencing .nav-toggle is recorded as a superseded dependency row rather than a gateable missing-target finding. The same script also references .search-results, which is absent from the source entry, so it is recorded as a dependency row without becoming a missing-target finding."
  },
  "legacy_comparison": {
    "skip": true,
    "reason": "Runtime dependency parity is an upstream artifact compiler contract with no legacy comparison."
  },
  "operation": "artifact_compiler.compile",
  "input": {
    "artifact": {
      "entrypoint": "index.html",
      "files": [
        {
          "path": "index.html",
          "kind": "html",
          "content": "<header class=\"site-header\"><nav class=\"site-nav\" aria-label=\"Primary\"><button class=\"nav-toggle\" aria-label=\"Toggle menu\" aria-expanded=\"false\" aria-controls=\"nav-links\"><span></span><span></span><span></span></button><ul class=\"nav-links\" id=\"nav-links\"><li><a href=\"/\">Home</a></li><li><a href=\"/about\">About</a></li></ul></nav><script src=\"js/app.js\"></script></header>"
        },
        {
          "path": "js/app.js",
          "kind": "js",
          "content": "var t = document.querySelector('.nav-toggle'); t.addEventListener('click', function(){});\nvar r = document.querySelector('.search-results'); r.addEventListener('scroll', function(){});\n"
        }
      ]
    }
  },
  "expect": [
    { "path": "status", "assert": "equals", "value": "success" },
    { "path": "diagnostics", "assert": "count", "count": 0 },
    { "path": "source_reports.wordpress_site_plan.schema", "assert": "equals", "value": "blocks-engine/wordpress-site-plan/v3" },
    { "path": "source_reports.runtime_dependency_parity.status", "assert": "equals", "value": "pass" },
    { "path": "source_reports.runtime_dependency_parity.dependencies", "assert": "count", "count": 2 },
    { "path": "source_reports.superseded_selectors.0", "assert": "equals", "value": ".nav-toggle" },

    { "path": "source_reports.runtime_dependency_parity.dependencies.0.selector", "assert": "equals", "value": ".nav-toggle" },
    { "path": "source_reports.runtime_dependency_parity.dependencies.0.source_present", "assert": "equals", "value": true },
    { "path": "source_reports.runtime_dependency_parity.dependencies.0.generated_present", "assert": "equals", "value": false },
    { "path": "source_reports.runtime_dependency_parity.dependencies.0.disposition", "assert": "equals", "value": "superseded_by_native_interactivity" },

    { "path": "source_reports.runtime_dependency_parity.dependencies.1.selector", "assert": "equals", "value": ".search-results" },
    { "path": "source_reports.runtime_dependency_parity.dependencies.1.source_present", "assert": "equals", "value": false },
    { "path": "source_reports.runtime_dependency_parity.dependencies.1.generated_present", "assert": "equals", "value": false }
  ]
}
