{
  "schema": "blocks-engine/php-transformer/parity-fixture/v1",
  "name": "artifact-inline-style-extraction-base64",
  "description": "Extracts inline stylesheet rules from base64-encoded full HTML documents into materializable CSS assets, matching the real import CLI which transmits file payloads as content_base64.",
  "source_reference": {
    "repo": "php-transformer",
    "path": "tests/fixtures/parity/artifact-inline-style-extraction-base64.json",
    "notes": "Real import-theme CLI payloads carry HTML as content_base64; inline <style> extraction must decode the payload before scanning so it does not regress to an empty stylesheet."
  },
  "legacy_comparison": {
    "skip": true,
    "reason": "This upstream artifact primitive fixture has no downstream legacy comparison."
  },
  "operation": "artifact_compiler.compile",
  "input": {
    "artifact": {
      "files": [
        {
          "path": "index.html",
          "content_base64": "PCFkb2N0eXBlIGh0bWw+PGh0bWw+PGhlYWQ+PHRpdGxlPlN0eWxlZCBQb3J0Zm9saW88L3RpdGxlPjxzdHlsZT46cm9vdHstLWFjY2VudDojYzRhMzVhOy0taW5rOiMxYTFhMWF9Ym9keXtiYWNrZ3JvdW5kOiNmYWY3ZjA7Y29sb3I6dmFyKC0taW5rKX0uaGVyb3ttaW4taGVpZ2h0OjEwMHZoO2NvbG9yOnZhcigtLWFjY2VudCl9LmNhcmR7Ym9yZGVyOjFweCBzb2xpZCB2YXIoLS1hY2NlbnQpO3BhZGRpbmc6MnJlbX0ud29yay1ncmlke2Rpc3BsYXk6Z3JpZDtncmlkLXRlbXBsYXRlLWNvbHVtbnM6MmZyIDFmciAxZnJ9PC9zdHlsZT48L2hlYWQ+PGJvZHk+PG1haW4+PHNlY3Rpb24gY2xhc3M9Imhlcm8iPjxoMT5TdHlsZWQgUG9ydGZvbGlvPC9oMT48cD5WaXN1YWwgY2xhc3NlcyBuZWVkIHRoZWlyIHN0eWxlc2hlZXQuPC9wPjwvc2VjdGlvbj48c2VjdGlvbiBjbGFzcz0id29yay1ncmlkIj48YXJ0aWNsZSBjbGFzcz0iY2FyZCI+PGgyPkNhc2UgU3R1ZHk8L2gyPjwvYXJ0aWNsZT48L3NlY3Rpb24+PC9tYWluPjwvYm9keT48L2h0bWw+",
          "kind": "html"
        }
      ]
    }
  },
  "expect": [
    { "path": "status", "assert": "equals", "value": "success" },
    { "path": "assets", "assert": "count", "count": 2 },
    { "path": "assets.0.path", "assert": "equals", "value": "assets/css/engine-support-before-author-1c2aa37274b6f89d.css" },
    { "path": "assets.0.source", "assert": "equals", "value": "engine-support" },
    { "path": "assets.0.stylesheet_placement", "assert": "equals", "value": "before-author" },
    { "path": "assets.0.content", "assert": "contains", "value": ":root :where(.blocks-engine-css-owned-grid)>:where(:not(h1,h2,h3,h4,h5,h6)){margin-block-start:0;margin-block-end:0}" },
    { "path": "assets.0.content", "assert": "contains", "value": ":root :where(.blocks-engine-css-owned-layout)>.block-editor-inner-blocks>.block-editor-block-list__layout{display:contents}" },
    { "path": "assets.1.path", "assert": "equals", "value": "index.inline.css" },
    { "path": "assets.1.kind", "assert": "equals", "value": "css" },
    { "path": "assets.1.role", "assert": "equals", "value": "stylesheet" },
    { "path": "assets.1.content", "assert": "contains", "value": ":root{--accent:#c4a35a" },
    { "path": "assets.1.content", "assert": "contains", "value": "body{background:#faf7f0;color:var(--ink)}" },
    { "path": "assets.1.content", "assert": "contains", "value": ".card{border:1px solid var(--accent)" },
    { "path": "source_reports.artifact.files_by_source.inline-style", "assert": "equals", "value": 1 },
    { "path": "source_reports.artifact.files_by_intent.style", "assert": "equals", "value": 1 },
    { "path": "source_reports.compiled_site.theme.stylesheets.1", "assert": "equals", "value": "index.inline.css" },
    { "path": "source_reports.materialization_plan.assets.1.target_path", "assert": "equals", "value": "index.inline.css" },
    { "path": "source_reports.materialization_plan.assets.1.content", "assert": "contains", "value": ":root{--accent:var(--wp--preset--color--primary,#c4a35a)" },
    { "path": "serialized_blocks", "assert": "contains", "value": "Styled Portfolio" },
    { "path": "serialized_blocks", "assert": "contains", "value": "hero" }
  ]
}
